<?xml version="1.0" encoding="UTF-8"?>

<PrEEAF xmlns:xsi="http://www.w3.org/2001/XMLSchema-instance"
        xsi:noNamespaceSchemaLocation="./preeaf.xsd">

    <Argument id="argument1">
        <name>eta</name>
    </Argument>

    <Argument id="argument2">
        <name>argument2</name>
    </Argument>

    <Argument id="argument3">
        <name>argument3</name>
    </Argument>

    <Support id="support1">
        <Froms refids="argument1 argument3"/>
        <To refid="argument2"/>
        <probability>0.35</probability>
    </Support>

    <Attack id="attack2">
        <From refid="argument2"/>
        <To refid="argument3"/>
        <probability>0.12</probability>
    </Attack>


    <Attack id="attack1">
        <From refid="argument2"/>
        <To refid="attack2"/>
        <probability>0.51</probability>
    </Attack>

</PrEEAF>